{
  "$schema": "https://json-schema.org/draft/2020-12/schema",
  "type": "object",
  "properties": {
    "group": {
      "type": "object",
      "properties": {
        "name": {
          "default": "ПОНБ-УП-304С",
          "type": "string",
          "const": "ПОНБ-УП-304С"
        },
        "specialty": {
          "default": "Правовое обеспечение национальной безопасности",
          "type": "string",
          "minLength": 1
        },
        "timezone": {
          "default": "Asia/Yekaterinburg",
          "type": "string",
          "const": "Asia/Yekaterinburg"
        },
        "course": {
          "type": "string",
          "minLength": 1
        },
        "semester": {
          "type": "string",
          "minLength": 1
        },
        "studyForm": {
          "type": "string",
          "minLength": 1
        },
        "semesterStart": {
          "type": "string",
          "format": "date",
          "pattern": "^(?:(?:\\d\\d[2468][048]|\\d\\d[13579][26]|\\d\\d0[48]|[02468][048]00|[13579][26]00)-02-29|\\d{4}-(?:(?:0[13578]|1[02])-(?:0[1-9]|[12]\\d|3[01])|(?:0[469]|11)-(?:0[1-9]|[12]\\d|30)|(?:02)-(?:0[1-9]|1\\d|2[0-8])))$"
        },
        "semesterEnd": {
          "type": "string",
          "format": "date",
          "pattern": "^(?:(?:\\d\\d[2468][048]|\\d\\d[13579][26]|\\d\\d0[48]|[02468][048]00|[13579][26]00)-02-29|\\d{4}-(?:(?:0[13578]|1[02])-(?:0[1-9]|[12]\\d|3[01])|(?:0[469]|11)-(?:0[1-9]|[12]\\d|30)|(?:02)-(?:0[1-9]|1\\d|2[0-8])))$"
        },
        "referenceWeek": {
          "type": "string",
          "format": "date",
          "pattern": "^(?:(?:\\d\\d[2468][048]|\\d\\d[13579][26]|\\d\\d0[48]|[02468][048]00|[13579][26]00)-02-29|\\d{4}-(?:(?:0[13578]|1[02])-(?:0[1-9]|[12]\\d|3[01])|(?:0[469]|11)-(?:0[1-9]|[12]\\d|30)|(?:02)-(?:0[1-9]|1\\d|2[0-8])))$"
        },
        "publishRoster": {
          "default": false,
          "type": "boolean"
        },
        "groupTeacherIds": {
          "default": [],
          "type": "array",
          "items": {
            "type": "string",
            "pattern": "^[\\p{L}\\p{N}_-]+$"
          }
        }
      },
      "required": [
        "name",
        "specialty",
        "timezone",
        "publishRoster",
        "groupTeacherIds"
      ],
      "additionalProperties": false
    },
    "subjects": {
      "type": "array",
      "items": {
        "type": "object",
        "properties": {
          "id": {
            "type": "string",
            "pattern": "^[\\p{L}\\p{N}_-]+$"
          },
          "title": {
            "type": "string",
            "minLength": 1
          },
          "description": {
            "type": "string"
          },
          "teacherIds": {
            "default": [],
            "type": "array",
            "items": {
              "type": "string",
              "pattern": "^[\\p{L}\\p{N}_-]+$"
            }
          },
          "order": {
            "default": 0,
            "type": "number"
          }
        },
        "required": [
          "id",
          "title",
          "teacherIds",
          "order"
        ],
        "additionalProperties": false
      }
    },
    "topics": {
      "type": "array",
      "items": {
        "type": "object",
        "properties": {
          "id": {
            "type": "string",
            "pattern": "^[\\p{L}\\p{N}_-]+$"
          },
          "title": {
            "type": "string",
            "minLength": 1
          },
          "subjectId": {
            "type": "string",
            "pattern": "^[\\p{L}\\p{N}_-]+$"
          },
          "description": {
            "type": "string"
          },
          "order": {
            "default": 0,
            "type": "number"
          }
        },
        "required": [
          "id",
          "title",
          "subjectId",
          "order"
        ],
        "additionalProperties": false
      }
    },
    "materials": {
      "type": "array",
      "items": {
        "type": "object",
        "properties": {
          "id": {
            "type": "string",
            "pattern": "^[\\p{L}\\p{N}_-]+$"
          },
          "title": {
            "type": "string",
            "minLength": 1
          },
          "subjectId": {
            "type": "string",
            "pattern": "^[\\p{L}\\p{N}_-]+$"
          },
          "topicId": {
            "type": "string",
            "pattern": "^[\\p{L}\\p{N}_-]+$"
          },
          "type": {
            "default": "Учебный материал",
            "type": "string",
            "enum": [
              "Конспект",
              "Задача",
              "Презентация",
              "Учебный материал",
              "Вопросы к экзамену",
              "Судебная практика",
              "Другое"
            ]
          },
          "format": {
            "type": "string",
            "minLength": 1
          },
          "description": {
            "type": "string"
          },
          "tags": {
            "default": [],
            "type": "array",
            "items": {
              "type": "string",
              "minLength": 1
            }
          },
          "path": {
            "type": "string",
            "minLength": 1
          },
          "content": {
            "type": "string"
          },
          "variant": {
            "type": "string",
            "enum": [
              "full",
              "short"
            ]
          },
          "addedAt": {
            "type": "string",
            "format": "date",
            "pattern": "^(?:(?:\\d\\d[2468][048]|\\d\\d[13579][26]|\\d\\d0[48]|[02468][048]00|[13579][26]00)-02-29|\\d{4}-(?:(?:0[13578]|1[02])-(?:0[1-9]|[12]\\d|3[01])|(?:0[469]|11)-(?:0[1-9]|[12]\\d|30)|(?:02)-(?:0[1-9]|1\\d|2[0-8])))$"
          },
          "updatedAt": {
            "type": "string",
            "format": "date",
            "pattern": "^(?:(?:\\d\\d[2468][048]|\\d\\d[13579][26]|\\d\\d0[48]|[02468][048]00|[13579][26]00)-02-29|\\d{4}-(?:(?:0[13578]|1[02])-(?:0[1-9]|[12]\\d|3[01])|(?:0[469]|11)-(?:0[1-9]|[12]\\d|30)|(?:02)-(?:0[1-9]|1\\d|2[0-8])))$"
          },
          "order": {
            "default": 0,
            "type": "number"
          },
          "relatedIds": {
            "default": [],
            "type": "array",
            "items": {
              "type": "string",
              "pattern": "^[\\p{L}\\p{N}_-]+$"
            }
          },
          "sourceUrl": {
            "type": "string",
            "format": "uri"
          },
          "verifiedAt": {
            "type": "string",
            "format": "date",
            "pattern": "^(?:(?:\\d\\d[2468][048]|\\d\\d[13579][26]|\\d\\d0[48]|[02468][048]00|[13579][26]00)-02-29|\\d{4}-(?:(?:0[13578]|1[02])-(?:0[1-9]|[12]\\d|3[01])|(?:0[469]|11)-(?:0[1-9]|[12]\\d|30)|(?:02)-(?:0[1-9]|1\\d|2[0-8])))$"
          },
          "verificationNote": {
            "type": "string"
          },
          "alt": {
            "type": "string"
          },
          "task": {
            "type": "object",
            "properties": {
              "condition": {
                "type": "string",
                "minLength": 1
              },
              "questions": {
                "default": [],
                "type": "array",
                "items": {
                  "type": "string",
                  "minLength": 1
                }
              },
              "solution": {
                "type": "string"
              },
              "shortSolution": {
                "type": "string"
              },
              "sources": {
                "default": [],
                "type": "array",
                "items": {
                  "type": "string",
                  "minLength": 1
                }
              }
            },
            "required": [
              "condition",
              "questions",
              "sources"
            ],
            "additionalProperties": false
          }
        },
        "required": [
          "id",
          "title",
          "subjectId",
          "topicId",
          "type",
          "format",
          "tags",
          "path",
          "order",
          "relatedIds"
        ],
        "additionalProperties": false
      }
    },
    "schedule": {
      "type": "object",
      "properties": {
        "lessons": {
          "default": [],
          "type": "array",
          "items": {
            "type": "object",
            "properties": {
              "id": {
                "type": "string",
                "pattern": "^[\\p{L}\\p{N}_-]+$"
              },
              "subjectId": {
                "type": "string",
                "pattern": "^[\\p{L}\\p{N}_-]+$"
              },
              "date": {
                "type": "string",
                "format": "date",
                "pattern": "^(?:(?:\\d\\d[2468][048]|\\d\\d[13579][26]|\\d\\d0[48]|[02468][048]00|[13579][26]00)-02-29|\\d{4}-(?:(?:0[13578]|1[02])-(?:0[1-9]|[12]\\d|3[01])|(?:0[469]|11)-(?:0[1-9]|[12]\\d|30)|(?:02)-(?:0[1-9]|1\\d|2[0-8])))$"
              },
              "weekday": {
                "type": "integer",
                "minimum": 1,
                "maximum": 7
              },
              "parity": {
                "default": "all",
                "type": "string",
                "enum": [
                  "all",
                  "odd",
                  "even"
                ]
              },
              "start": {
                "type": "string",
                "pattern": "^([01]\\d|2[0-3]):[0-5]\\d$"
              },
              "end": {
                "type": "string",
                "pattern": "^([01]\\d|2[0-3]):[0-5]\\d$"
              },
              "kind": {
                "type": "string"
              },
              "room": {
                "type": "string"
              },
              "url": {
                "type": "string",
                "format": "uri"
              },
              "teacherId": {
                "type": "string",
                "pattern": "^[\\p{L}\\p{N}_-]+$"
              },
              "note": {
                "type": "string"
              }
            },
            "required": [
              "id",
              "subjectId",
              "parity",
              "start",
              "end"
            ],
            "additionalProperties": false
          }
        },
        "exceptions": {
          "default": [],
          "type": "array",
          "items": {
            "type": "object",
            "properties": {
              "date": {
                "type": "string",
                "format": "date",
                "pattern": "^(?:(?:\\d\\d[2468][048]|\\d\\d[13579][26]|\\d\\d0[48]|[02468][048]00|[13579][26]00)-02-29|\\d{4}-(?:(?:0[13578]|1[02])-(?:0[1-9]|[12]\\d|3[01])|(?:0[469]|11)-(?:0[1-9]|[12]\\d|30)|(?:02)-(?:0[1-9]|1\\d|2[0-8])))$"
              },
              "lessons": {
                "type": "array",
                "items": {
                  "type": "object",
                  "properties": {
                    "id": {
                      "type": "string",
                      "pattern": "^[\\p{L}\\p{N}_-]+$"
                    },
                    "subjectId": {
                      "type": "string",
                      "pattern": "^[\\p{L}\\p{N}_-]+$"
                    },
                    "date": {
                      "type": "string",
                      "format": "date",
                      "pattern": "^(?:(?:\\d\\d[2468][048]|\\d\\d[13579][26]|\\d\\d0[48]|[02468][048]00|[13579][26]00)-02-29|\\d{4}-(?:(?:0[13578]|1[02])-(?:0[1-9]|[12]\\d|3[01])|(?:0[469]|11)-(?:0[1-9]|[12]\\d|30)|(?:02)-(?:0[1-9]|1\\d|2[0-8])))$"
                    },
                    "weekday": {
                      "type": "integer",
                      "minimum": 1,
                      "maximum": 7
                    },
                    "parity": {
                      "default": "all",
                      "type": "string",
                      "enum": [
                        "all",
                        "odd",
                        "even"
                      ]
                    },
                    "start": {
                      "type": "string",
                      "pattern": "^([01]\\d|2[0-3]):[0-5]\\d$"
                    },
                    "end": {
                      "type": "string",
                      "pattern": "^([01]\\d|2[0-3]):[0-5]\\d$"
                    },
                    "kind": {
                      "type": "string"
                    },
                    "room": {
                      "type": "string"
                    },
                    "url": {
                      "type": "string",
                      "format": "uri"
                    },
                    "teacherId": {
                      "type": "string",
                      "pattern": "^[\\p{L}\\p{N}_-]+$"
                    },
                    "note": {
                      "type": "string"
                    }
                  },
                  "required": [
                    "id",
                    "subjectId",
                    "parity",
                    "start",
                    "end"
                  ],
                  "additionalProperties": false
                }
              }
            },
            "required": [
              "date",
              "lessons"
            ],
            "additionalProperties": false
          }
        }
      },
      "required": [
        "lessons",
        "exceptions"
      ],
      "additionalProperties": false
    },
    "assignments": {
      "type": "array",
      "items": {
        "type": "object",
        "properties": {
          "id": {
            "type": "string",
            "pattern": "^[\\p{L}\\p{N}_-]+$"
          },
          "title": {
            "type": "string",
            "minLength": 1
          },
          "subjectId": {
            "type": "string",
            "pattern": "^[\\p{L}\\p{N}_-]+$"
          },
          "description": {
            "type": "string"
          },
          "dueDate": {
            "type": "string",
            "format": "date",
            "pattern": "^(?:(?:\\d\\d[2468][048]|\\d\\d[13579][26]|\\d\\d0[48]|[02468][048]00|[13579][26]00)-02-29|\\d{4}-(?:(?:0[13578]|1[02])-(?:0[1-9]|[12]\\d|3[01])|(?:0[469]|11)-(?:0[1-9]|[12]\\d|30)|(?:02)-(?:0[1-9]|1\\d|2[0-8])))$"
          },
          "dueTime": {
            "type": "string",
            "pattern": "^([01]\\d|2[0-3]):[0-5]\\d$"
          },
          "materialIds": {
            "default": [],
            "type": "array",
            "items": {
              "type": "string",
              "pattern": "^[\\p{L}\\p{N}_-]+$"
            }
          }
        },
        "required": [
          "id",
          "title",
          "subjectId",
          "description",
          "materialIds"
        ],
        "additionalProperties": false
      }
    },
    "announcements": {
      "type": "array",
      "items": {
        "type": "object",
        "properties": {
          "id": {
            "type": "string",
            "pattern": "^[\\p{L}\\p{N}_-]+$"
          },
          "title": {
            "type": "string",
            "minLength": 1
          },
          "body": {
            "type": "string",
            "minLength": 1
          },
          "publishedAt": {
            "type": "string",
            "format": "date",
            "pattern": "^(?:(?:\\d\\d[2468][048]|\\d\\d[13579][26]|\\d\\d0[48]|[02468][048]00|[13579][26]00)-02-29|\\d{4}-(?:(?:0[13578]|1[02])-(?:0[1-9]|[12]\\d|3[01])|(?:0[469]|11)-(?:0[1-9]|[12]\\d|30)|(?:02)-(?:0[1-9]|1\\d|2[0-8])))$"
          },
          "expiresAt": {
            "type": "string",
            "format": "date",
            "pattern": "^(?:(?:\\d\\d[2468][048]|\\d\\d[13579][26]|\\d\\d0[48]|[02468][048]00|[13579][26]00)-02-29|\\d{4}-(?:(?:0[13578]|1[02])-(?:0[1-9]|[12]\\d|3[01])|(?:0[469]|11)-(?:0[1-9]|[12]\\d|30)|(?:02)-(?:0[1-9]|1\\d|2[0-8])))$"
          },
          "pinned": {
            "default": false,
            "type": "boolean"
          }
        },
        "required": [
          "id",
          "title",
          "body",
          "publishedAt",
          "pinned"
        ],
        "additionalProperties": false
      }
    },
    "examQuestions": {
      "type": "array",
      "items": {
        "type": "object",
        "properties": {
          "id": {
            "type": "string",
            "pattern": "^[\\p{L}\\p{N}_-]+$"
          },
          "title": {
            "type": "string",
            "minLength": 1
          },
          "subjectId": {
            "type": "string",
            "pattern": "^[\\p{L}\\p{N}_-]+$"
          },
          "answer": {
            "type": "string"
          },
          "materialIds": {
            "default": [],
            "type": "array",
            "items": {
              "type": "string",
              "pattern": "^[\\p{L}\\p{N}_-]+$"
            }
          }
        },
        "required": [
          "id",
          "title",
          "subjectId",
          "materialIds"
        ],
        "additionalProperties": false
      }
    },
    "roster": {
      "type": "array",
      "items": {
        "type": "object",
        "properties": {
          "id": {
            "type": "string",
            "pattern": "^[\\p{L}\\p{N}_-]+$"
          },
          "name": {
            "type": "string",
            "minLength": 1
          },
          "role": {
            "type": "string"
          },
          "order": {
            "default": 0,
            "type": "number"
          }
        },
        "required": [
          "id",
          "name",
          "order"
        ],
        "additionalProperties": false
      }
    }
  },
  "required": [
    "group",
    "subjects",
    "topics",
    "materials",
    "schedule",
    "assignments",
    "announcements",
    "examQuestions",
    "roster"
  ],
  "additionalProperties": false
}
