{
  "group": {
    "name": "ПОНБ-УП-304С",
    "specialty": "Правовое обеспечение национальной безопасности",
    "timezone": "Asia/Yekaterinburg",
    "publishRoster": false,
    "groupTeacherIds": []
  },
  "subjects": [],
  "topics": [],
  "materials": [],
  "schedule": {
    "lessons": [],
    "exceptions": []
  },
  "assignments": [],
  "announcements": [],
  "examQuestions": [],
  "roster": []
}
